[
  {
    "content": {
      "attributes": {
        "clock_offset_s": 0.0,
        "level_m": 4.995272,
        "pump_on": false,
        "valve_open": false
      },
      "event_id": "UC3-EV-000001",
      "event_time": 0.0,
      "event_type": "process_observation",
      "message_id": null,
      "payload_hash": "732e9b99b48e27784ce00c90d8a8fecf9609c8b4cf11117bb8104f381e6c9b23",
      "source_entity": "UC3-D02",
      "target_entity": "UC3-D05"
    },
    "content_sha256": "d9a1c60b4a9165d9f752a3e674862f5c7974a61b765faa808d54ee1142e4a7db",
    "evidence_id": "UC3-ED-000001",
    "evidence_type": "process_observation",
    "source_event_id": "UC3-EV-000001"
  },
  {
    "content": {
      "attributes": {
        "clock_offset_s": 0.0,
        "level_m": 4.99717,
        "pump_on": false,
        "valve_open": false
      },
      "event_id": "UC3-EV-000002",
      "event_time": 5.0,
      "event_type": "process_observation",
      "message_id": null,
      "payload_hash": "f9517e9ebc88eb415177455962de1b27c22f1af839d04f12c7efcb2285e12e2d",
      "source_entity": "UC3-D02",
      "target_entity": "UC3-D05"
    },
    "content_sha256": "73c65e426d2ecf6709d2d8f64b52fd6a4fe57630b419c13c24433e4a16e3cc9d",
    "evidence_id": "UC3-ED-000002",
    "evidence_type": "process_observation",
    "source_event_id": "UC3-EV-000002"
  },
  {
    "content": {
      "attributes": {
        "clock_offset_s": 0.0,
        "level_m": 5.009125,
        "pump_on": false,
        "valve_open": false
      },
      "event_id": "UC3-EV-000003",
      "event_time": 10.0,
      "event_type": "process_observation",
      "message_id": null,
      "payload_hash": "eb25018849cfdbbaf03bc5094dbb7a8b069e94271f63681996b91e3a3b1ad0df",
      "source_entity": "UC3-D02",
      "target_entity": "UC3-D05"
    },
    "content_sha256": "7cf2bf3585d3dcb7affb4c9ba6dd9077e3ac52b0a844298e3ce40d135835817e",
    "evidence_id": "UC3-ED-000003",
    "evidence_type": "process_observation",
    "source_event_id": "UC3-EV-000003"
  },
  {
    "content": {
      "attributes": {
        "clock_offset_s": 0.0,
        "level_m": 4.987726,
        "pump_on": false,
        "valve_open": false
      },
      "event_id": "UC3-EV-000004",
      "event_time": 15.0,
      "event_type": "process_observation",
      "message_id": null,
      "payload_hash": "7ebeb7446f220e32a7cf7519fbf268bd39871a198b251d51503ad3ede87cdb9a",
      "source_entity": "UC3-D02",
      "target_entity": "UC3-D05"
    },
    "content_sha256": "653f2e8250e50390558a14b8c62efb72b444db081cf9021425cd28c758408d3d",
    "evidence_id": "UC3-ED-000004",
    "evidence_type": "process_observation",
    "source_event_id": "UC3-EV-000004"
  },
  {
    "content": {
      "attributes": {
        "clock_offset_s": 0.0,
        "level_m": 5.014875,
        "pump_on": false,
        "valve_open": false
      },
      "event_id": "UC3-EV-000005",
      "event_time": 20.0,
      "event_type": "process_observation",
      "message_id": null,
      "payload_hash": "4dfd51e3d042e320024ca48ae6511af916897bd13d7c5a25d08a051fa7295aea",
      "source_entity": "UC3-D02",
      "target_entity": "UC3-D05"
    },
    "content_sha256": "1ec18bf9f26079ba57488df6778136de9dc1bea63c14e9b97129ed10b03f2aba",
    "evidence_id": "UC3-ED-000005",
    "evidence_type": "process_observation",
    "source_event_id": "UC3-EV-000005"
  },
  {
    "content": {
      "attributes": {
        "clock_offset_s": 0.0,
        "level_m": 5.000845,
        "pump_on": false,
        "valve_open": false
      },
      "event_id": "UC3-EV-000006",
      "event_time": 25.0,
      "event_type": "process_observation",
      "message_id": null,
      "payload_hash": "e1c21b6ebb2235995d70ac4ce54828523db275fd3385f5cca0d855ef5c23c55f",
      "source_entity": "UC3-D02",
      "target_entity": "UC3-D05"
    },
    "content_sha256": "e52af4d0683bf1843ce8abaa5145a6ee84616bbf7514ababde4cb2c9775dca73",
    "evidence_id": "UC3-ED-000006",
    "evidence_type": "process_observation",
    "source_event_id": "UC3-EV-000006"
  },
  {
    "content": {
      "attributes": {
        "clock_offset_s": 0.0,
        "level_m": 4.985794,
        "pump_on": false,
        "valve_open": false
      },
      "event_id": "UC3-EV-000007",
      "event_time": 30.0,
      "event_type": "process_observation",
      "message_id": null,
      "payload_hash": "d41a712337ec79396f84bbeb2108b624be98ccf04dcbe14f4edbd95112b0727c",
      "source_entity": "UC3-D02",
      "target_entity": "UC3-D05"
    },
    "content_sha256": "2e7f1102735bd549d6d9b9299091a7244590f2e4ff789798a9eacc2537563861",
    "evidence_id": "UC3-ED-000007",
    "evidence_type": "process_observation",
    "source_event_id": "UC3-EV-000007"
  },
  {
    "content": {
      "attributes": {
        "clock_offset_s": 0.0,
        "level_m": 4.988055,
        "pump_on": false,
        "valve_open": false
      },
      "event_id": "UC3-EV-000008",
      "event_time": 35.0,
      "event_type": "process_observation",
      "message_id": null,
      "payload_hash": "2a178731d72054f6e4d53936a46655e43c6b10d0bfcf8d038218fddebac4fe13",
      "source_entity": "UC3-D02",
      "target_entity": "UC3-D05"
    },
    "content_sha256": "efbbd97cc6e7c49c39df6c27ec4b5c93197202b9e3576d0d8d29aa5a560e44cd",
    "evidence_id": "UC3-ED-000008",
    "evidence_type": "process_observation",
    "source_event_id": "UC3-EV-000008"
  },
  {
    "content": {
      "attributes": {
        "clock_offset_s": 0.0,
        "level_m": 5.019943,
        "pump_on": false,
        "valve_open": false
      },
      "event_id": "UC3-EV-000009",
      "event_time": 40.0,
      "event_type": "process_observation",
      "message_id": null,
      "payload_hash": "cf31d4929f4f92264ccfb0de1100b886abadbed86783d50ede79272be7dd44f9",
      "source_entity": "UC3-D02",
      "target_entity": "UC3-D05"
    },
    "content_sha256": "2d9fb0278a1bbd587334d549e11d1f454a39019b8cab6de5931f745e2e2e7a5c",
    "evidence_id": "UC3-ED-000009",
    "evidence_type": "process_observation",
    "source_event_id": "UC3-EV-000009"
  },
  {
    "content": {
      "attributes": {
        "clock_offset_s": 0.0,
        "level_m": 4.99873,
        "pump_on": false,
        "valve_open": false
      },
      "event_id": "UC3-EV-000010",
      "event_time": 45.0,
      "event_type": "process_observation",
      "message_id": null,
      "payload_hash": "5798c9010078830f7af690a5359a265faa7f2e709a0f631c9bbf80301c894e29",
      "source_entity": "UC3-D02",
      "target_entity": "UC3-D05"
    },
    "content_sha256": "961d5d125ebd99b75054ffc41fcb39a128b4ab3ca7632d0d874db8f3e46f0a32",
    "evidence_id": "UC3-ED-000010",
    "evidence_type": "process_observation",
    "source_event_id": "UC3-EV-000010"
  },
  {
    "content": {
      "attributes": {
        "clock_offset_s": 0.0,
        "level_m": 4.994224,
        "pump_on": false,
        "valve_open": false
      },
      "event_id": "UC3-EV-000011",
      "event_time": 50.0,
      "event_type": "process_observation",
      "message_id": null,
      "payload_hash": "9a43dfaf3db22e0dcf9b42ebaed2ca173118e53f148b9ccfa2ef136771b5909e",
      "source_entity": "UC3-D02",
      "target_entity": "UC3-D05"
    },
    "content_sha256": "7279481f231938618f596bf1052476d1e7aed55ca9113106fd511f12d7999927",
    "evidence_id": "UC3-ED-000011",
    "evidence_type": "process_observation",
    "source_event_id": "UC3-EV-000011"
  },
  {
    "content": {
      "attributes": {
        "clock_offset_s": 0.0,
        "level_m": 4.995663,
        "pump_on": false,
        "valve_open": false
      },
      "event_id": "UC3-EV-000012",
      "event_time": 55.0,
      "event_type": "process_observation",
      "message_id": null,
      "payload_hash": "92f604eecb00aa1d914b451093bf6d7fd43fd4d4545d9324082db776a56818c1",
      "source_entity": "UC3-D02",
      "target_entity": "UC3-D05"
    },
    "content_sha256": "385b9192a53ba3d7b214cfd2631bfb8ad8bf04abf3cdf9df85c4465ce86ef0cb",
    "evidence_id": "UC3-ED-000012",
    "evidence_type": "process_observation",
    "source_event_id": "UC3-EV-000012"
  },
  {
    "content": {
      "attributes": {
        "clock_offset_s": 0.0,
        "level_m": 5.021291,
        "pump_on": false,
        "valve_open": false
      },
      "event_id": "UC3-EV-000013",
      "event_time": 60.0,
      "event_type": "process_observation",
      "message_id": null,
      "payload_hash": "89dc7c995225875c5e163723f22220a813df580a98318a60c8fc7f55f8a364a6",
      "source_entity": "UC3-D02",
      "target_entity": "UC3-D05"
    },
    "content_sha256": "07af6c8ebf26e1d14791350c3f59d52fea546940feb2c4a2b65dcba0e1e0810e",
    "evidence_id": "UC3-ED-000013",
    "evidence_type": "process_observation",
    "source_event_id": "UC3-EV-000013"
  },
  {
    "content": {
      "attributes": {
        "clock_offset_s": 0.0,
        "level_m": 5.016204,
        "pump_on": false,
        "valve_open": false
      },
      "event_id": "UC3-EV-000014",
      "event_time": 65.0,
      "event_type": "process_observation",
      "message_id": null,
      "payload_hash": "9c65c6f17f6d14fe055772df0861459d8b9ff4516040bacf14fc49c66ff5724d",
      "source_entity": "UC3-D02",
      "target_entity": "UC3-D05"
    },
    "content_sha256": "fc34fa30df78434fe2970997ddb9b3e2821a5781629d909e54400362982fbcb1",
    "evidence_id": "UC3-ED-000014",
    "evidence_type": "process_observation",
    "source_event_id": "UC3-EV-000014"
  },
  {
    "content": {
      "attributes": {
        "clock_offset_s": 0.0,
        "level_m": 5.006975,
        "pump_on": false,
        "valve_open": false
      },
      "event_id": "UC3-EV-000015",
      "event_time": 70.0,
      "event_type": "process_observation",
      "message_id": null,
      "payload_hash": "aeee25bbdd1942c952bc247d4890d10f3cbb7fcc94acdf06b2ccad9747e31355",
      "source_entity": "UC3-D02",
      "target_entity": "UC3-D05"
    },
    "content_sha256": "cc383ca04278fb115a51871d85e36a45be7c56fcf7c70e15a53b698a05c0ed2d",